title,price,status,rating,image
Slow States of Collapse: Poems,57.31,In stock,Three,../media/cache/72/41/72417db983862010ef0c1a25de98c7d7.jpg
Reasons to Stay Alive,26.41,In stock,Two,../media/cache/cb/bd/cbbdb0222ee8a0f6ab61657412a15794.jpg
Private Paris (Private #10),47.61,In stock,Five,../media/cache/9d/05/9d0533bae1578846d728a82913b95c26.jpg
#HigherSelfie: Wake Up Your Life. Free Your Soul. Find Your Tribe.,23.11,In stock,Five,../media/cache/9c/46/9c463c7631c82401160fd3b554b8f0e1.jpg
Without Borders (Wanderlove #1),45.07,In stock,Two,../media/cache/24/e2/24e2f5c9d325c4004d8190c054da86dd.jpg
When We Collided,31.77,In stock,One,../media/cache/08/04/08044269fc197645268a6197c57e6173.jpg
"We Love You, Charlie Freeman",50.27,In stock,Five,../media/cache/5f/15/5f152afdbc42356ecba02f61058a7e5b.jpg
Untitled Collection: Sabbath Poems 2014,14.27,In stock,Four,../media/cache/f9/3b/f93b4a650f03a5d21f2436d7813f42c2.jpg
"Unseen City: The Majesty of Pigeons, the Discreet Charm of Snails & Other Wonders of the Urban Wilderness",44.18,In stock,Four,../media/cache/41/a2/41a20f35adf0caea24f208dc01ad7681.jpg
Unicorn Tracks,18.78,In stock,Three,../media/cache/76/8e/768ea5924ac1ef6297c2be9959c796c2.jpg
"Unbound: How Eight Technologies Made Us Human, Transformed Society, and Brought Our World to the Brink",25.52,In stock,One,../media/cache/4a/3b/4a3b055f9e378a95fedbef55e7bab7ce.jpg
Tsubasa: WoRLD CHRoNiCLE 2 (Tsubasa WoRLD CHRoNiCLE #2),16.28,In stock,One,../media/cache/36/df/36df4caaf1420b1183a8235355d39e69.jpg
Throwing Rocks at the Google Bus: How Growth Became the Enemy of Prosperity,31.12,In stock,Three,../media/cache/03/86/038650c9e7517b4baf2a423cd8eed38f.jpg
This One Summer,19.49,In stock,Four,../media/cache/c4/dd/c4ddd9ced89966b0602ec85e00cd5b61.jpg
Thirst,17.27,In stock,Five,../media/cache/c4/0a/c40a64f59e7487b1a80a049f6ceb2ba5.jpg
The Torch Is Passed: A Harding Family Story,19.09,In stock,One,../media/cache/33/e5/33e507172541628acfd421503196b578.jpg
The Secret of Dreadwillow Carse,56.13,In stock,One,../media/cache/c4/a2/c4a2a1a026c67bcceb5a411c724d7d0c.jpg
"The Pioneer Woman Cooks: Dinnertime: Comfort Classics, Freezer Food, 16-Minute Meals, and Other Delicious Ways to Solve Supper!",56.41,In stock,One,../media/cache/b7/f4/b7f4843dbe062d44be1ffcfa16b2faa4.jpg
The Past Never Ends,56.5,In stock,Four,../media/cache/89/b8/89b850edb01851a91f64ba114b96acb6.jpg
The Natural History of Us (The Fine Art of Pretending #2),45.22,In stock,Three,../media/cache/5d/7f/5d7f496cdf5e5962a73ecdcc1505c1d5.jpg
